{
  "$schema": "https://json-schema.org/draft/2020-12/schema",
  "$id": "https://aether.invalid/contracts/schemas/analysis-upload-v2.schema.json",
  "title": "AETHER AnalysisUploadV2",
  "type": "object",
  "required": [
    "schemaVersion",
    "createdAt",
    "durationMs",
    "sampling",
    "producer",
    "mediaFingerprintAtStart",
    "frames"
  ],
  "properties": {
    "schemaVersion": {
      "const": 2
    },
    "createdAt": {
      "type": "string",
      "format": "date-time"
    },
    "durationMs": {
      "type": "integer",
      "minimum": 1
    },
    "sampling": {
      "$ref": "#/$defs/sampling"
    },
    "producer": {
      "$ref": "#/$defs/producer"
    },
    "mediaFingerprintAtStart": {
      "type": "string",
      "pattern": "^sha256:[0-9a-f]{64}$"
    },
    "clientContentFingerprint": {
      "$ref": "#/$defs/clientContentFingerprint"
    },
    "frames": {
      "type": "array",
      "minItems": 1,
      "maxItems": 86400,
      "items": {
        "$ref": "#/$defs/frame"
      }
    },
    "audioFrames": {
      "type": "array",
      "maxItems": 864000,
      "items": {
        "$ref": "#/$defs/audioFrame"
      }
    }
  },
  "$defs": {
    "sampling": {
      "type": "object",
      "required": ["intervalMs", "frameWidth", "frameHeight", "colorSpace"],
      "properties": {
        "intervalMs": {
          "type": "integer",
          "minimum": 250,
          "maximum": 10000,
          "default": 250
        },
        "frameWidth": {
          "type": "integer",
          "minimum": 16,
          "maximum": 1920,
          "default": 480
        },
        "frameHeight": {
          "type": "integer",
          "minimum": 16,
          "maximum": 1080,
          "default": 270
        },
        "colorSpace": {
          "const": "srgb"
        }
      }
    },
    "clientContentFingerprint": {
      "type": "object",
      "required": ["algorithm", "value"],
      "properties": {
        "algorithm": {
          "type": "string",
          "minLength": 1,
          "maxLength": 64
        },
        "value": {
          "type": "string",
          "pattern": "^sha256:[0-9a-f]{64}$"
        }
      }
    },
    "producer": {
      "type": "object",
      "required": ["name", "version", "platform"],
      "properties": {
        "name": {
          "type": "string",
          "minLength": 1,
          "maxLength": 64
        },
        "version": {
          "type": "string",
          "minLength": 1,
          "maxLength": 32
        },
        "platform": {
          "enum": ["browser", "server"]
        }
      }
    },
    "frame": {
      "type": "object",
      "required": [
        "timestampMs",
        "luminance",
        "contrast",
        "saturation",
        "motionEnergy",
        "sceneCutProbability",
        "palette"
      ],
      "properties": {
        "timestampMs": {
          "type": "integer",
          "minimum": 0
        },
        "luminance": {
          "$ref": "#/$defs/unitInterval"
        },
        "contrast": {
          "$ref": "#/$defs/unitInterval"
        },
        "saturation": {
          "$ref": "#/$defs/unitInterval"
        },
        "motionEnergy": {
          "$ref": "#/$defs/unitInterval"
        },
        "sceneCutProbability": {
          "$ref": "#/$defs/unitInterval"
        },
        "audio": {
          "$ref": "#/$defs/audioMetrics"
        },
        "palette": {
          "type": "array",
          "maxItems": 5,
          "items": {
            "$ref": "#/$defs/color"
          }
        }
      }
    },
    "audioMetrics": {
      "type": "object",
      "required": ["rms", "flux"],
      "properties": {
        "rms": {
          "$ref": "#/$defs/unitInterval"
        },
        "flux": {
          "$ref": "#/$defs/unitInterval"
        }
      }
    },
    "audioFrame": {
      "allOf": [
        {
          "$ref": "#/$defs/audioMetrics"
        },
        {
          "type": "object",
          "required": ["timestampMs"],
          "properties": {
            "timestampMs": {
              "type": "integer",
              "minimum": 0
            }
          }
        }
      ]
    },
    "color": {
      "type": "object",
      "required": ["red", "green", "blue", "coverage"],
      "properties": {
        "red": {
          "$ref": "#/$defs/byte"
        },
        "green": {
          "$ref": "#/$defs/byte"
        },
        "blue": {
          "$ref": "#/$defs/byte"
        },
        "coverage": {
          "$ref": "#/$defs/unitInterval"
        }
      }
    },
    "byte": {
      "type": "integer",
      "minimum": 0,
      "maximum": 255
    },
    "unitInterval": {
      "type": "number",
      "minimum": 0,
      "maximum": 1
    }
  }
}
